[
  {
    "schemaVersion": 1,
    "command": "verify",
    "invocationId": "inv-verify",
    "engine": {
      "version": "0.0.0",
      "artifactDigest": "sha256:aaaaaaaaaaaaaaaaaaaaaaaaaaaaaaaaaaaaaaaaaaaaaaaaaaaaaaaaaaaaaaaa"
    },
    "operationalStatus": "completed",
    "startedAt": "2026-07-18T12:00:00Z",
    "durationMs": 12,
    "result": {
      "kind": "verify",
      "outcome": "satisfied",
      "applicationModel": {
        "kind": "applicationModel",
        "id": "model-1",
        "revision": "sha256:bbbbbbbbbbbbbbbbbbbbbbbbbbbbbbbbbbbbbbbbbbbbbbbbbbbbbbbbbbbbbbbb",
        "schemaVersion": 1
      },
      "summary": {
        "requiredPromiseCount": 1,
        "advisoryPromiseCount": 0,
        "satisfiedCount": 1,
        "violatedCount": 0,
        "indeterminateCount": 0
      },
      "promises": [],
      "proofExecutions": [],
      "evidence": [],
      "repairs": [],
      "executionManifests": [],
      "cacheDecisions": []
    },
    "diagnostics": []
  },
  {
    "schemaVersion": 1,
    "command": "dispatchVerification",
    "invocationId": "inv-dispatch",
    "engine": {
      "version": "0.0.0",
      "artifactDigest": "sha256:aaaaaaaaaaaaaaaaaaaaaaaaaaaaaaaaaaaaaaaaaaaaaaaaaaaaaaaaaaaaaaaa"
    },
    "operationalStatus": "completed",
    "startedAt": "2026-07-18T12:00:01Z",
    "durationMs": 2,
    "result": {
      "kind": "dispatchVerification",
      "dispatchId": "dispatch-1",
      "state": "accepted",
      "workloadBinding": "workload-1",
      "verifyInvocationId": "inv-workload",
      "reasonCodes": []
    },
    "diagnostics": []
  },
  {
    "schemaVersion": 1,
    "command": "publishedVerification",
    "invocationId": "inv-publication",
    "engine": {
      "version": "0.0.0",
      "artifactDigest": "sha256:aaaaaaaaaaaaaaaaaaaaaaaaaaaaaaaaaaaaaaaaaaaaaaaaaaaaaaaaaaaaaaaa"
    },
    "operationalStatus": "completed",
    "startedAt": "2026-07-18T12:00:02Z",
    "durationMs": 3,
    "result": {
      "kind": "publishedVerification",
      "purpose": "teamHistory",
      "tenantId": "tenant-1",
      "projectId": "project-1",
      "runId": "published-run-1",
      "idempotencyKey": "idempotency-1",
      "applicationModel": {
        "objectType": "applicationModel",
        "publicationId": "pub-model-1",
        "tenantBinding": "tenant-1"
      },
      "operationalStatus": "completed",
      "outcome": "satisfied",
      "engine": {
        "id": "engine",
        "version": "0.0.0",
        "artifactDigest": "sha256:aaaaaaaaaaaaaaaaaaaaaaaaaaaaaaaaaaaaaaaaaaaaaaaaaaaaaaaaaaaaaaaa"
      },
      "protocolVersion": 1,
      "plugins": [],
      "promises": [
        {
          "promise": {
            "objectType": "promise",
            "publicationId": "pub-promise-1",
            "tenantBinding": "tenant-1"
          },
          "status": "satisfied",
          "reasonCodes": []
        }
      ],
      "proofs": [
        {
          "proof": {
            "objectType": "proof",
            "publicationId": "pub-proof-1",
            "tenantBinding": "tenant-1"
          },
          "status": "passed",
          "reasonCodes": [],
          "durationMs": 8
        }
      ],
      "evidence": [
        {
          "evidence": {
            "objectType": "evidence",
            "publicationId": "pub-evidence-1",
            "tenantBinding": "tenant-1"
          },
          "evidenceType": "workspace-manifest",
          "byteSize": 42,
          "sensitivityClass": "SENSITIVE_EVIDENCE"
        }
      ],
      "summary": {
        "promiseCount": 1,
        "proofCount": 1,
        "evidenceCount": 1,
        "durationMs": 12
      },
      "applicationAlias": "sample",
      "auditCorrelationId": "audit-1",
      "retentionClass": "metadata-30d"
    },
    "diagnostics": []
  },
  {
    "schemaVersion": 1,
    "command": "getRun",
    "invocationId": "inv-get-run",
    "engine": {
      "version": "0.0.0",
      "artifactDigest": "sha256:aaaaaaaaaaaaaaaaaaaaaaaaaaaaaaaaaaaaaaaaaaaaaaaaaaaaaaaaaaaaaaaa"
    },
    "operationalStatus": "completed",
    "startedAt": "2026-07-18T12:00:03Z",
    "durationMs": 1,
    "result": {
      "kind": "getRun",
      "run": {
        "schemaVersion": 1,
        "command": "verify",
        "invocationId": "inv-retained",
        "engine": {
          "version": "0.0.0",
          "artifactDigest": "sha256:aaaaaaaaaaaaaaaaaaaaaaaaaaaaaaaaaaaaaaaaaaaaaaaaaaaaaaaaaaaaaaaa"
        },
        "operationalStatus": "completed",
        "startedAt": "2026-07-18T11:00:00Z",
        "durationMs": 12,
        "result": {
          "kind": "verify",
          "outcome": "not_evaluated",
          "applicationModel": {
            "kind": "applicationModel",
            "id": "model-2",
            "revision": "sha256:cccccccccccccccccccccccccccccccccccccccccccccccccccccccccccccccc",
            "schemaVersion": 1
          },
          "summary": {
            "requiredPromiseCount": 0,
            "advisoryPromiseCount": 0,
            "satisfiedCount": 0,
            "violatedCount": 0,
            "indeterminateCount": 0
          },
          "promises": [],
          "proofExecutions": [],
          "evidence": [],
          "repairs": [],
          "executionManifests": [],
          "cacheDecisions": []
        },
        "diagnostics": []
      }
    },
    "diagnostics": []
  },
  {
    "schemaVersion": 1,
    "command": "getPublishedRun",
    "invocationId": "inv-get-published",
    "engine": {
      "version": "0.0.0",
      "artifactDigest": "sha256:aaaaaaaaaaaaaaaaaaaaaaaaaaaaaaaaaaaaaaaaaaaaaaaaaaaaaaaaaaaaaaaa"
    },
    "operationalStatus": "completed",
    "startedAt": "2026-07-18T12:00:04Z",
    "durationMs": 1,
    "result": {
      "kind": "getPublishedRun",
      "run": {
        "kind": "publishedVerification",
        "purpose": "teamHistory",
        "tenantId": "tenant-1",
        "projectId": "project-1",
        "runId": "published-run-1",
        "idempotencyKey": "idempotency-1",
        "applicationModel": {
          "objectType": "applicationModel",
          "publicationId": "pub-model-1",
          "tenantBinding": "tenant-1"
        },
        "operationalStatus": "completed",
        "outcome": "satisfied",
        "engine": {
          "id": "engine",
          "version": "0.0.0",
          "artifactDigest": "sha256:aaaaaaaaaaaaaaaaaaaaaaaaaaaaaaaaaaaaaaaaaaaaaaaaaaaaaaaaaaaaaaaa"
        },
        "protocolVersion": 1,
        "plugins": [],
        "promises": [],
        "proofs": [],
        "evidence": [],
        "summary": {
          "promiseCount": 0,
          "proofCount": 0,
          "evidenceCount": 0,
          "durationMs": 12
        },
        "auditCorrelationId": "audit-1",
        "retentionClass": "metadata-30d"
      }
    },
    "diagnostics": []
  }
]
